### ISSUE TITLE
Data is sent through the VLAN interface, but not received at the other end..

### ISSUE THREAD

**Issue by kewinrausch** [IRATI/stack#185]
<a href="https://github.com/edugrasa"><img src="https://avatars.githubusercontent.com/u/325005?v=3" align="left" width="96" height="96" hspace="10"></img></a> **Issue by [edugrasa](https://github.com/edugrasa)**
_Monday Nov 04, 2013 at 09:36 GMT_
_Originally opened as https://github.com/dana-i2cat/irati/issues/182_

----

TCPdump in "echo-client VM":

10:22:14.135821 ARP, Ethernet (len 6), Unknown Protocol (0xd1f0) (len 30), length 80
10:22:14.153003 ARP, Ethernet (len 6), Unknown Protocol (0xd1f0) (len 30), length 80
10:22:14.276829 08:00:27:5f:af:eb (oui Unknown) > 08:00:27:db:01:e0 (oui Unknown), ethertype 802.1Q (0x8100), length 118: 
	0x0000:  6b00 0000 0000 0000 0000 0000 0000 0000  k...............
	0x0010:  0000 0000 0000 0000 0000 0000 0000 0000  ................
	0x0020:  0000 0000 0000 0000 0000 0000 0000 0000  ................
	0x0030:  0000 0000 0000 0000 0000 0000 0000 0000  ................
	0x0040:  0000 0000 0000 0000 0000 0000 0000 0000  ................
	0x0050:  0000 0000 0000 0000 0000 0000 0000 0000  ................
	0x0060:  0000 0000                                ....
10:22:14.296849 08:00:27:5f:af:eb (oui Unknown) > 08:00:27:db:01:e0 (oui Unknown), ethertype 802.1Q (0x8100), length 118: 
	0x0000:  6b00 0000 0000 0000 0000 0000 0000 0000  k...............
	0x0010:  0000 0000 0000 0000 0000 0000 0000 0000  ................
	0x0020:  0000 0000 0000 0000 0000 0000 0000 0000  ................
	0x0030:  0000 0000 0000 0000 0000 0000 0000 0000  ................
	0x0040:  0000 0000 0000 0000 0000 0000 0000 0000  ................
	0x0050:  0000 0000 0000 0000 0000 0000 0000 0000  ................
	0x0060:  0000 0000                                ....
10:22:14.301042 08:00:27:5f:af:eb (oui Unknown) > 08:00:27:db:01:e0 (oui Unknown), ethertype 802.1Q (0x8100), length 118: 
	0x0000:  6b00 0000 0000 0000 0000 0000 0000 0000  k...............
	0x0010:  0000 0000 0000 0000 0000 0000 0000 0000  ................
	0x0020:  0000 0000 0000 0000 0000 0000 0000 0000  ................
	0x0030:  0000 0000 0000 0000 0000 0000 0000 0000  ................
	0x0040:  0000 0000 0000 0000 0000 0000 0000 0000  ................
	0x0050:  0000 0000 0000 0000 0000 0000 0000 0000  ................
	0x0060:  0000 0000                                ....
10:22:14.308578 08:00:27:5f:af:eb (oui Unknown) > 08:00:27:db:01:e0 (oui Unknown), ethertype 802.1Q (0x8100), length 118: 
	0x0000:  6b00 0000 0000 0000 0000 0000 0000 0000  k...............
	0x0010:  0000 0000 0000 0000 0000 0000 0000 0000  ................
	0x0020:  0000 0000 0000 0000 0000 0000 0000 0000  ................
	0x0030:  0000 0000 0000 0000 0000 0000 0000 0000  ................
	0x0040:  0000 0000 0000 0000 0000 0000 0000 0000  ................
	0x0050:  0000 0000 0000 0000 0000 0000 0000 0000  ................
	0x0060:  0000 0000                                ....
10:22:14.322243 08:00:27:5f:af:eb (oui Unknown) > 08:00:27:db:01:e0 (oui Unknown), ethertype 802.1Q (0x8100), length 118: 
	0x0000:  6b00 0000 0000 0000 0000 0000 0000 0000  k...............
	0x0010:  0000 0000 0000 0000 0000 0000 0000 0000  ................
	0x0020:  0000 0000 0000 0000 0000 0000 0000 0000  ................
	0x0030:  0000 0000 0000 0000 0000 0000 0000 0000  ................
	0x0040:  0000 0000 0000 0000 0000 0000 0000 0000  ................
	0x0050:  0000 0000 0000 0000 0000 0000 0000 0000  ................
	0x0060:  0000 0000                                ....
10:22:14.324283 08:00:27:5f:af:eb (oui Unknown) > 08:00:27:db:01:e0 (oui Unknown), ethertype 802.1Q (0x8100), length 118: 
	0x0000:  6b00 0000 0000 0000 0000 0000 0000 0000  k...............
	0x0010:  0000 0000 0000 0000 0000 0000 0000 0000  ................
	0x0020:  0000 0000 0000 0000 0000 0000 0000 0000  ................
	0x0030:  0000 0000 0000 0000 0000 0000 0000 0000  ................
	0x0040:  0000 0000 0000 0000 0000 0000 0000 0000  ................
	0x0050:  0000 0000 0000 0000 0000 0000 0000 0000  ................
	0x0060:  0000 0000                                ....
10:22:14.325482 08:00:27:5f:af:eb (oui Unknown) > 08:00:27:db:01:e0 (oui Unknown), ethertype 802.1Q (0x8100), length 118: 
	0x0000:  6b00 0000 0000 0000 0000 0000 0000 0000  k...............
	0x0010:  0000 0000 0000 0000 0000 0000 0000 0000  ................
	0x0020:  0000 0000 0000 0000 0000 0000 0000 0000  ................
	0x0030:  0000 0000 0000 0000 0000 0000 0000 0000  ................
	0x0040:  0000 0000 0000 0000 0000 0000 0000 0000  ................
	0x0050:  0000 0000 0000 0000 0000 0000 0000 0000  ................
	0x0060:  0000 0000                                ....
10:22:14.330072 08:00:27:5f:af:eb (oui Unknown) > 08:00:27:db:01:e0 (oui Unknown), ethertype 802.1Q (0x8100), length 118: 
	0x0000:  6b00 0000 0000 0000 0000 0000 0000 0000  k...............
	0x0010:  0000 0000 0000 0000 0000 0000 0000 0000  ................
	0x0020:  0000 0000 0000 0000 0000 0000 0000 0000  ................
	0x0030:  0000 0000 0000 0000 0000 0000 0000 0000  ................
	0x0040:  0000 0000 0000 0000 0000 0000 0000 0000  ................
	0x0050:  0000 0000 0000 0000 0000 0000 0000 0000  ................
	0x0060:  0000 0000                                ....
10:22:14.335246 08:00:27:5f:af:eb (oui Unknown) > 08:00:27:db:01:e0 (oui Unknown), ethertype 802.1Q (0x8100), length 118: 
	0x0000:  6b00 0000 0000 0000 0000 0000 0000 0000  k...............
	0x0010:  0000 0000 0000 0000 0000 0000 0000 0000  ................
	0x0020:  0000 0000 0000 0000 0000 0000 0000 0000  ................
	0x0030:  0000 0000 0000 0000 0000 0000 0000 0000  ................
	0x0040:  0000 0000 0000 0000 0000 0000 0000 0000  ................
	0x0050:  0000 0000 0000 0000 0000 0000 0000 0000  ................
	0x0060:  0000 0000                                ....
10:22:14.339214 08:00:27:5f:af:eb (oui Unknown) > 08:00:27:db:01:e0 (oui Unknown), ethertype 802.1Q (0x8100), length 118: 
	0x0000:  6b00 0000 0000 0000 0000 0000 0000 0000  k...............
	0x0010:  0000 0000 0000 0000 0000 0000 0000 0000  ................
	0x0020:  0000 0000 0000 0000 0000 0000 0000 0000  ................
	0x0030:  0000 0000 0000 0000 0000 0000 0000 0000  ................
	0x0040:  0000 0000 0000 0000 0000 0000 0000 0000  ................
	0x0050:  0000 0000 0000 0000 0000 0000 0000 0000  ................
	0x0060:  0000 0000                                ....
10:22:14.369688 08:00:27:5f:af:eb (oui Unknown) > 08:00:27:db:01:e0 (oui Unknown), ethertype 802.1Q (0x8100), length 118: 
	0x0000:  6b00 0000 0000 0000 0000 0000 0000 0000  k...............
	0x0010:  0000 0000 0000 0000 0000 0000 0000 0000  ................
	0x0020:  0000 0000 0000 0000 0000 0000 0000 0000  ................
	0x0030:  0000 0000 0000 0000 0000 0000 0000 0000  ................
	0x0040:  0000 0000 0000 0000 0000 0000 0000 0000  ................
	0x0050:  0000 0000 0000 0000 0000 0000 0000 0000  ................
	0x0060:  0000 0000                                ....
10:22:14.376404 08:00:27:5f:af:eb (oui Unknown) > 08:00:27:db:01:e0 (oui Unknown), ethertype 802.1Q (0x8100), length 118: 
	0x0000:  6b00 0000 0000 0000 0000 0000 0000 0000  k...............
	0x0010:  0000 0000 0000 0000 0000 0000 0000 0000  ................
	0x0020:  0000 0000 0000 0000 0000 0000 0000 0000  ................
	0x0030:  0000 0000 0000 0000 0000 0000 0000 0000  ................
	0x0040:  0000 0000 0000 0000 0000 0000 0000 0000  ................
	0x0050:  0000 0000 0000 0000 0000 0000 0000 0000  ................
	0x0060:  0000 0000                                ....
10:22:14.379691 08:00:27:5f:af:eb (oui Unknown) > 08:00:27:db:01:e0 (oui Unknown), ethertype 802.1Q (0x8100), length 118: 
	0x0000:  6b00 0000 0000 0000 0000 0000 0000 0000  k...............
	0x0010:  0000 0000 0000 0000 0000 0000 0000 0000  ................
	0x0020:  0000 0000 0000 0000 0000 0000 0000 0000  ................
	0x0030:  0000 0000 0000 0000 0000 0000 0000 0000  ................
	0x0040:  0000 0000 0000 0000 0000 0000 0000 0000  ................
	0x0050:  0000 0000 0000 0000 0000 0000 0000 0000  ................
	0x0060:  0000 0000                                ....
10:22:14.396093 08:00:27:5f:af:eb (oui Unknown) > 08:00:27:db:01:e0 (oui Unknown), ethertype 802.1Q (0x8100), length 118: 
	0x0000:  6b00 0000 0000 0000 0000 0000 0000 0000  k...............
	0x0010:  0000 0000 0000 0000 0000 0000 0000 0000  ................
	0x0020:  0000 0000 0000 0000 0000 0000 0000 0000  ................
	0x0030:  0000 0000 0000 0000 0000 0000 0000 0000  ................
	0x0040:  0000 0000 0000 0000 0000 0000 0000 0000  ................
	0x0050:  0000 0000 0000 0000 0000 0000 0000 0000  ................
	0x0060:  0000 0000                                ....
10:22:14.408647 08:00:27:5f:af:eb (oui Unknown) > 08:00:27:db:01:e0 (oui Unknown), ethertype 802.1Q (0x8100), length 118: 
	0x0000:  6b00 0000 0000 0000 0000 0000 0000 0000  k...............
	0x0010:  0000 0000 0000 0000 0000 0000 0000 0000  ................
	0x0020:  0000 0000 0000 0000 0000 0000 0000 0000  ................
	0x0030:  0000 0000 0000 0000 0000 0000 0000 0000  ................
	0x0040:  0000 0000 0000 0000 0000 0000 0000 0000  ................
	0x0050:  0000 0000 0000 0000 0000 0000 0000 0000  ................
	0x0060:  0000 0000                                ....
10:22:14.412306 08:00:27:5f:af:eb (oui Unknown) > 08:00:27:db:01:e0 (oui Unknown), ethertype 802.1Q (0x8100), length 118: 
	0x0000:  6b00 0000 0000 0000 0000 0000 0000 0000  k...............
	0x0010:  0000 0000 0000 0000 0000 0000 0000 0000  ................
	0x0020:  0000 0000 0000 0000 0000 0000 0000 0000  ................
	0x0030:  0000 0000 0000 0000 0000 0000 0000 0000  ................
	0x0040:  0000 0000 0000 0000 0000 0000 0000 0000  ................
	0x0050:  0000 0000 0000 0000 0000 0000 0000 0000  ................
	0x0060:  0000 0000                                ....
10:22:14.421074 08:00:27:5f:af:eb (oui Unknown) > 08:00:27:db:01:e0 (oui Unknown), ethertype 802.1Q (0x8100), length 118: 
	0x0000:  6b00 0000 0000 0000 0000 0000 0000 0000  k...............
	0x0010:  0000 0000 0000 0000 0000 0000 0000 0000  ................
	0x0020:  0000 0000 0000 0000 0000 0000 0000 0000  ................
	0x0030:  0000 0000 0000 0000 0000 0000 0000 0000  ................
	0x0040:  0000 0000 0000 0000 0000 0000 0000 0000  ................
	0x0050:  0000 0000 0000 0000 0000 0000 0000 0000  ................
	0x0060:  0000 0000                                ....
10:22:14.428239 08:00:27:5f:af:eb (oui Unknown) > 08:00:27:db:01:e0 (oui Unknown), ethertype 802.1Q (0x8100), length 118: 
	0x0000:  6b00 0000 0000 0000 0000 0000 0000 0000  k...............
	0x0010:  0000 0000 0000 0000 0000 0000 0000 0000  ................
	0x0020:  0000 0000 0000 0000 0000 0000 0000 0000  ................
	0x0030:  0000 0000 0000 0000 0000 0000 0000 0000  ................
	0x0040:  0000 0000 0000 0000 0000 0000 0000 0000  ................
	0x0050:  0000 0000 0000 0000 0000 0000 0000 0000  ................
	0x0060:  0000 0000                                ....
10:22:14.432731 08:00:27:5f:af:eb (oui Unknown) > 08:00:27:db:01:e0 (oui Unknown), ethertype 802.1Q (0x8100), length 118: 
	0x0000:  6b00 0000 0000 0000 0000 0000 0000 0000  k...............
	0x0010:  0000 0000 0000 0000 0000 0000 0000 0000  ................
	0x0020:  0000 0000 0000 0000 0000 0000 0000 0000  ................
	0x0030:  0000 0000 0000 0000 0000 0000 0000 0000  ................
	0x0040:  0000 0000 0000 0000 0000 0000 0000 0000  ................
	0x0050:  0000 0000 0000 0000 0000 0000 0000 0000  ................
	0x0060:  0000 0000                                ....
10:22:14.450056 08:00:27:5f:af:eb (oui Unknown) > 08:00:27:db:01:e0 (oui Unknown), ethertype 802.1Q (0x8100), length 118: 
	0x0000:  6b00 0000 0000 0000 0000 0000 0000 0000  k...............
	0x0010:  0000 0000 0000 0000 0000 0000 0000 0000  ................
	0x0020:  0000 0000 0000 0000 0000 0000 0000 0000  ................
	0x0030:  0000 0000 0000 0000 0000 0000 0000 0000  ................
	0x0040:  0000 0000 0000 0000 0000 0000 0000 0000  ................
	0x0050:  0000 0000 0000 0000 0000 0000 0000 0000  ................
	0x0060:  0000 0000                                ....
10:22:14.461490 08:00:27:5f:af:eb (oui Unknown) > 08:00:27:db:01:e0 (oui Unknown), ethertype 802.1Q (0x8100), length 118: 
	0x0000:  6b00 0000 0000 0000 0000 0000 0000 0000  k...............
	0x0010:  0000 0000 0000 0000 0000 0000 0000 0000  ................
	0x0020:  0000 0000 0000 0000 0000 0000 0000 0000  ................
	0x0030:  0000 0000 0000 0000 0000 0000 0000 0000  ................
	0x0040:  0000 0000 0000 0000 0000 0000 0000 0000  ................
	0x0050:  0000 0000 0000 0000 0000 0000 0000 0000  ................
	0x0060:  0000 0000                                ....
10:22:14.464459 08:00:27:5f:af:eb (oui Unknown) > 08:00:27:db:01:e0 (oui Unknown), ethertype 802.1Q (0x8100), length 118: 
	0x0000:  6b00 0000 0000 0000 0000 0000 0000 0000  k...............
	0x0010:  0000 0000 0000 0000 0000 0000 0000 0000  ................
	0x0020:  0000 0000 0000 0000 0000 0000 0000 0000  ................
	0x0030:  0000 0000 0000 0000 0000 0000 0000 0000  ................
	0x0040:  0000 0000 0000 0000 0000 0000 0000 0000  ................
	0x0050:  0000 0000 0000 0000 0000 0000 0000 0000  ................
	0x0060:  0000 0000                                ....
10:22:14.466485 08:00:27:5f:af:eb (oui Unknown) > 08:00:27:db:01:e0 (oui Unknown), ethertype 802.1Q (0x8100), length 118: 
	0x0000:  6b00 0000 0000 0000 0000 0000 0000 0000  k...............
	0x0010:  0000 0000 0000 0000 0000 0000 0000 0000  ................
	0x0020:  0000 0000 0000 0000 0000 0000 0000 0000  ................
	0x0030:  0000 0000 0000 0000 0000 0000 0000 0000  ................
	0x0040:  0000 0000 0000 0000 0000 0000 0000 0000  ................
	0x0050:  0000 0000 0000 0000 0000 0000 0000 0000  ................
	0x0060:  0000 0000                                ....
10:22:14.468228 08:00:27:5f:af:eb (oui Unknown) > 08:00:27:db:01:e0 (oui Unknown), ethertype 802.1Q (0x8100), length 118: 
	0x0000:  6b00 0000 0000 0000 0000 0000 0000 0000  k...............
	0x0010:  0000 0000 0000 0000 0000 0000 0000 0000  ................
	0x0020:  0000 0000 0000 0000 0000 0000 0000 0000  ................
	0x0030:  0000 0000 0000 0000 0000 0000 0000 0000  ................
	0x0040:  0000 0000 0000 0000 0000 0000 0000 0000  ................
	0x0050:  0000 0000 0000 0000 0000 0000 0000 0000  ................
	0x0060:  0000 0000                                ....
10:22:14.470103 08:00:27:5f:af:eb (oui Unknown) > 08:00:27:db:01:e0 (oui Unknown), ethertype 802.1Q (0x8100), length 118: 
	0x0000:  6b00 0000 0000 0000 0000 0000 0000 0000  k...............
	0x0010:  0000 0000 0000 0000 0000 0000 0000 0000  ................
	0x0020:  0000 0000 0000 0000 0000 0000 0000 0000  ................
	0x0030:  0000 0000 0000 0000 0000 0000 0000 0000  ................
	0x0040:  0000 0000 0000 0000 0000 0000 0000 0000  ................
	0x0050:  0000 0000 0000 0000 0000 0000 0000 0000  ................
	0x0060:  0000 0000                                ....
10:22:14.471707 08:00:27:5f:af:eb (oui Unknown) > 08:00:27:db:01:e0 (oui Unknown), ethertype 802.1Q (0x8100), length 118: 
	0x0000:  6b00 0000 0000 0000 0000 0000 0000 0000  k...............
	0x0010:  0000 0000 0000 0000 0000 0000 0000 0000  ................
	0x0020:  0000 0000 0000 0000 0000 0000 0000 0000  ................
	0x0030:  0000 0000 0000 0000 0000 0000 0000 0000  ................
	0x0040:  0000 0000 0000 0000 0000 0000 0000 0000  ................
	0x0050:  0000 0000 0000 0000 0000 0000 0000 0000  ................
	0x0060:  0000 0000                                ....
10:22:14.473179 08:00:27:5f:af:eb (oui Unknown) > 08:00:27:db:01:e0 (oui Unknown), ethertype 802.1Q (0x8100), length 118: 
	0x0000:  6b00 0000 0000 0000 0000 0000 0000 0000  k...............
	0x0010:  0000 0000 0000 0000 0000 0000 0000 0000  ................
	0x0020:  0000 0000 0000 0000 0000 0000 0000 0000  ................
	0x0030:  0000 0000 0000 0000 0000 0000 0000 0000  ................
	0x0040:  0000 0000 0000 0000 0000 0000 0000 0000  ................
	0x0050:  0000 0000 0000 0000 0000 0000 0000 0000  ................
	0x0060:  0000 0000                                ....
10:22:14.489052 08:00:27:5f:af:eb (oui Unknown) > 08:00:27:db:01:e0 (oui Unknown), ethertype 802.1Q (0x8100), length 118: 
	0x0000:  6b00 0000 0000 0000 0000 0000 0000 0000  k...............
	0x0010:  0000 0000 0000 0000 0000 0000 0000 0000  ................
	0x0020:  0000 0000 0000 0000 0000 0000 0000 0000  ................
	0x0030:  0000 0000 0000 0000 0000 0000 0000 0000  ................
	0x0040:  0000 0000 0000 0000 0000 0000 0000 0000  ................
	0x0050:  0000 0000 0000 0000 0000 0000 0000 0000  ................
	0x0060:  0000 0000                                ....
10:22:14.525589 08:00:27:5f:af:eb (oui Unknown) > 08:00:27:db:01:e0 (oui Unknown), ethertype 802.1Q (0x8100), length 118: 
	0x0000:  6b00 0000 0000 0000 0000 0000 0000 0000  k...............
	0x0010:  0000 0000 0000 0000 0000 0000 0000 0000  ................
	0x0020:  0000 0000 0000 0000 0000 0000 0000 0000  ................
	0x0030:  0000 0000 0000 0000 0000 0000 0000 0000  ................
	0x0040:  0000 0000 0000 0000 0000 0000 0000 0000  ................
	0x0050:  0000 0000 0000 0000 0000 0000 0000 0000  ................
	0x0060:  0000 0000                                ....
10:22:14.530702 08:00:27:5f:af:eb (oui Unknown) > 08:00:27:db:01:e0 (oui Unknown), ethertype 802.1Q (0x8100), length 118: 
	0x0000:  6b00 0000 0000 0000 0000 0000 0000 0000  k...............
	0x0010:  0000 0000 0000 0000 0000 0000 0000 0000  ................
	0x0020:  0000 0000 0000 0000 0000 0000 0000 0000  ................
	0x0030:  0000 0000 0000 0000 0000 0000 0000 0000  ................
	0x0040:  0000 0000 0000 0000 0000 0000 0000 0000  ................
	0x0050:  0000 0000 0000 0000 0000 0000 0000 0000  ................
	0x0060:  0000 0000                                ....

TCP dump in "echo-server" VM:
10:20:57.470750 ARP, Ethernet (len 6), Unknown Protocol (0xd1f0) (len 30), length 80
10:20:57.471772 ARP, Ethernet (len 6), Unknown Protocol (0xd1f0) (len 30), length 80

**Comment by kewinrausch** [comment]
<a href="https://github.com/edugrasa"><img src="https://avatars.githubusercontent.com/u/325005?v=3" align="left" width="48" height="48" hspace="10"></img></a> **Comment by [edugrasa](https://github.com/edugrasa)**
_Monday Nov 04, 2013 at 09:43 GMT_

----

This looks promising..

![captura de pantalla 2013-11-04 a las 10 43 13](https://f.cloud.github.com/assets/325005/1463728/96a5eaec-4535-11e3-895a-42b994e83700.png)

**Comment by kewinrausch** [comment]
<a href="https://github.com/salvestrini"><img src="https://avatars.githubusercontent.com/u/81804?v=3" align="left" width="48" height="48" hspace="10"></img></a> **Comment by [salvestrini](https://github.com/salvestrini)**
_Monday Nov 04, 2013 at 09:46 GMT_

----

Argh

**Comment by kewinrausch** [comment]
<a href="https://github.com/edugrasa"><img src="https://avatars.githubusercontent.com/u/325005?v=3" align="left" width="48" height="48" hspace="10"></img></a> **Comment by [edugrasa](https://github.com/edugrasa)**
_Monday Nov 04, 2013 at 11:37 GMT_

----

Fixed by commit https://github.com/edugrasa/irati/commit/dcac71fad7dfa0553c2700ff9f11b7c6485bb904
